{
  "schema_version": "0.1.0",
  "id": "reference-context-compaction-v1",
  "title": "Reference Harness context compaction probe",
  "question": "Can the Reference Harness replace older turns with a deterministic checkpoint while preserving the verified conclusion?",
  "hypothesis": "Both repetitions will drop three messages, emit a 232-character checkpoint, preserve the declared conclusion, and share one normalized Trace fingerprint.",
  "mode": "controlled",
  "status": "complete",
  "fixture": {"path": "labs/fixtures/reference-mechanism-probes-v1", "revision": "fixture-v1", "sha256": "d369431d683da5c2cad36bb6dc6f76d429c2efbdc29171d5c8d9d4d7c3c575aa"},
  "scenario": {"path": "labs/scenarios/reference-context-compaction-v1.scenario.json", "prompt_sha256": "d48225211fab69c822df8f219e4e6c33c5c724a097f36375c43727194566e6e2"},
  "subjects": [{"agent_id": "reference-harness", "snapshot_id": "reference-harness-2026-08-10-controlled", "surface": "sdk", "model": "scripted-model-v1", "provider": "local-fixture", "comparison_status": "not-comparable", "configuration": {"lesson_id": "s08", "network": false, "writes": false}, "uncontrolled_variables": []}],
  "controls": {"network": false, "temperature": 0, "writes": false, "sandbox": "lesson-owned-temporary-fixture"},
  "repetitions": 2,
  "metrics": ["event-order-valid", "observations-match", "final-answer-match", "fixture-unchanged", "deterministic-replay"],
  "success_criteria": ["Both repetitions record three dropped messages and a 232-character compacted checkpoint.", "Both repetitions preserve the expected verified conclusion and share one Trace fingerprint."],
  "limitations": ["The checkpoint text is produced by deterministic lesson code, not a generative summarizer.", "The probe checks declared facts, not semantic recall across long real-world sessions.", "The Reference Harness result is not Native vendor evidence."],
  "outputs": {"traces_path": "labs/results/reference-context-compaction-v1", "results_path": "labs/results/reference-context-compaction-v1/result.json", "report_path": "labs/results/reference-context-compaction-v1/report.md"}
}
