{
  "schema_version": "0.1.0",
  "id": "reference-memory-retrieval-v1",
  "title": "Reference Harness memory retrieval probe",
  "question": "Can the Reference Harness retrieve a task-relevant memory source and select the declared skill without loading unrelated memory?",
  "hypothesis": "Both repetitions will cite AGENTS.md#testing, select test-first, return the expected plan, and share one normalized Trace fingerprint.",
  "mode": "controlled",
  "status": "complete",
  "fixture": {"path": "labs/fixtures/reference-mechanism-probes-v1", "revision": "fixture-v1", "sha256": "d369431d683da5c2cad36bb6dc6f76d429c2efbdc29171d5c8d9d4d7c3c575aa"},
  "scenario": {"path": "labs/scenarios/reference-memory-retrieval-v1.scenario.json", "prompt_sha256": "bab97a48fbc064150c113df8551727c7dc93abec9288a673737a562660e39bf9"},
  "subjects": [{"agent_id": "reference-harness", "snapshot_id": "reference-harness-2026-08-10-controlled", "surface": "sdk", "model": "scripted-model-v1", "provider": "local-fixture", "comparison_status": "not-comparable", "configuration": {"lesson_id": "s09", "network": false, "writes": false}, "uncontrolled_variables": []}],
  "controls": {"network": false, "temperature": 0, "writes": false, "sandbox": "lesson-owned-temporary-fixture"},
  "repetitions": 2,
  "metrics": ["event-order-valid", "observations-match", "final-answer-match", "fixture-unchanged", "deterministic-replay"],
  "success_criteria": ["Both repetitions cite only the declared testing memory source and select the test-first skill.", "Both repetitions return the expected plan and share one normalized Trace fingerprint."],
  "limitations": ["Retrieval uses a small deterministic teaching index, not embeddings or a production memory service.", "The probe does not measure ranking quality on ambiguous or adversarial corpora.", "The Reference Harness result is not Native vendor evidence."],
  "outputs": {"traces_path": "labs/results/reference-memory-retrieval-v1", "results_path": "labs/results/reference-memory-retrieval-v1/result.json", "report_path": "labs/results/reference-memory-retrieval-v1/report.md"}
}
